<?xml version="1.0" encoding="UTF-8"?>
<applications xmlns:xsi="http://www.w3.org/2001/XMLSchema-instance"
        xsi:noNamespaceSchemaLocation="pkimanagercredentialsrequest.xsd">
	<application>
		<certificates>
<!--Credentials for Secure communication -->	
			<certificate>
				 <overlapperiod>P2D</overlapperiod>
				<tbscertificate>
					<subject>
						<entityname>##HOSTNAME##_Infrastructure_PKI_Manager</entityname>
						<distinguishname>CN=##HOSTNAME##_Infrastructure_PKI_Manager, O=ericsson, OU=enm, C=SE</distinguishname>
					</subject>
				</tbscertificate>
				<endentityprofilename>credMServiceProfile</endentityprofilename>
				<keypair>
					<keypairsize>2048</keypairsize>
					<keypairalgorithm>RSA</keypairalgorithm>
				</keypair>
				<keystore>
					<pkcs12keystore>
						<storealias>infrastructure_pki_manager</storealias>
						<storelocation>/ericsson/sps/data/certs/PKIManagerKeyStore.p12</storelocation>
						<storepassword>C4bCzXyT</storepassword>
					</pkcs12keystore>
				</keystore>
				<truststore>
						<jkstruststore>
							<storealias>infrastructure_pki_manager_trust</storealias>
							<storelocation>/ericsson/sps/data/certs/PKIManagerTrustStore.jks</storelocation>
							<storepassword>C4bCzXyT</storepassword>
						</jkstruststore>
				</truststore>
			</certificate>			
		</certificates>
	</application>
</applications>
